Question,Answer
What is PCOS? , PCOS stands for Polycystic Ovary Syndrome which is a hormonal disorder affecting women of reproductive age.
What is PCOD? , PCOD stands for Polycystic Ovarian Disease where ovaries produce immature eggs that turn into cysts.
Are PCOS and PCOD the same?,They are related conditions but PCOS is generally considered more severe and involves hormonal imbalance.
What causes PCOS?,PCOS may be caused by hormonal imbalance genetics insulin resistance and lifestyle factors.
What are the symptoms of PCOS?,Common symptoms include irregular periods weight gain acne excessive hair growth and hair loss.
Can PCOS cause weight gain?,Yes hormonal imbalance and insulin resistance in PCOS can contribute to weight gain.
Can PCOS cause irregular periods?,Yes irregular or missed periods are one of the most common symptoms of PCOS.
Can PCOS cause infertility?,PCOS can make it difficult to conceive due to irregular ovulation but treatment can help.
Can PCOS be cured?,There is no permanent cure but symptoms can be effectively managed through lifestyle changes and treatment.
Can exercise help with PCOS?,Yes regular exercise can improve insulin sensitivity help manage weight and reduce symptoms.
What foods are good for PCOS?,Whole grains vegetables fruits lean proteins and healthy fats are beneficial for PCOS.
What foods should be avoided in PCOS?,Sugary foods processed foods and excessive refined carbohydrates should be limited.
Can stress worsen PCOS?,Yes stress may worsen hormonal imbalance and PCOS symptoms.
Is PCOS genetic?,Yes PCOS often runs in families indicating a genetic component.
Can PCOS cause acne?,Yes increased androgen levels in PCOS can lead to acne and oily skin.
Can PCOS cause hair loss?,Yes hormonal imbalance may cause thinning hair or hair loss.
Can PCOS cause facial hair?,Yes excess androgen hormones can cause unwanted facial and body hair growth.
What is insulin resistance in PCOS?,Insulin resistance means the body does not use insulin effectively leading to higher insulin levels.
Can PCOS increase diabetes risk?,Yes women with PCOS have a higher risk of developing type 2 diabetes.
Can PCOS affect mental health?,Yes PCOS is associated with anxiety depression and low self-esteem in some individuals.
How is PCOS diagnosed?,Doctors diagnose PCOS through symptoms blood tests ultrasound and medical history.
What is the treatment for PCOS?,Treatment may include lifestyle changes medications hormonal therapy and weight management.
Can weight loss improve PCOS?,Even modest weight loss can improve symptoms and hormone balance in many women.
Can teenagers have PCOS?,Yes PCOS can develop during teenage years after puberty.
Can PCOS affect sleep?,Yes PCOS may be associated with sleep disturbances and sleep apnea.
Can PCOS cause mood swings?,Hormonal changes in PCOS can contribute to mood swings and emotional changes.
Is yoga good for PCOS?,Yes yoga may help reduce stress improve flexibility and support hormonal balance.
Can PCOS affect pregnancy?,Women with PCOS can have healthy pregnancies but may require additional monitoring.
Can PCOS cause dark skin patches?,Yes insulin resistance can cause dark patches of skin known as acanthosis nigricans.
How can I manage PCOS naturally?,Healthy eating regular exercise stress management and adequate sleep can help manage PCOS symptoms.